{
  "case_id": "PCB-2026-001",
  "status": "confirmed",
  "server": "PhCraft",
  "player": {
    "name": "Google_6",
    "uuid": "bd55e715-c221-404b-a415-6b31382efbdd"
  },
  "incident": {
    "start": "2026-10-09T20:08:26+08:00",
    "end": "2026-10-09T22:00:34+08:00",
    "timezone": "Asia/Shanghai",
    "world": null,
    "location_public": "涉及 world、world_nether、resworld；精确坐标已隐藏。"
  },
  "violations": [
    "griefing"
  ],
  "punishment": {
    "type": "permanent_ban",
    "issued_at": null,
    "expires_at": null,
    "note": "服务器管理员确认本案处罚为永久封禁；未提供执行时间及封禁日志。"
  },
  "statistics": {
    "blocks_broken": 279,
    "blocks_placed": 255,
    "container_actions": 124
  },
  "evidence": [
    {
      "path": "evidence/coreprotect/actions.txt",
      "type": "coreprotect",
      "description": "取证端导出的审计记录；公开版使用稳定位置编号。"
    },
    {
      "path": "evidence/coreprotect/summary.txt",
      "type": "coreprotect",
      "description": "依据导出文件重新统计的行为摘要及证据边界。"
    },
    {
      "path": "evidence/logs/server-redacted.log",
      "type": "server_log",
      "description": "取证端改写的脱敏日志摘要，含源行号；非原样摘录。"
    },
    {
      "path": "evidence/other/coreprotect-config-relevant.txt",
      "type": "other",
      "description": "相关审计配置摘录。"
    },
    {
      "path": "evidence/other/provenance.md",
      "type": "other",
      "description": "证据来源、公开处理及本次复核范围。"
    }
  ],
  "assessment": "confirmed"
}
